{"metadata":{"documentType":"PROGRESSION_MODIFIER","schemaVersion":2,"key":"INTERMEDIATE_PROGRESSION_MODIFIER_V1","version":3,"status":"PUBLISHED","contentHash":"42748a44ebe107bef7d7ec53eedcde8ff235ccdf4ae7ecc663c9866c2c4bf7ea"},"experience":"INTERMEDIATE","maximumHardSessionsPerWeek":2,"mainSetDoseMultiplier":1.0,"allowGoalPaceRehearsal":true,"allowSecondHardStimulus":true}