{"metadata":{"documentType":"PROGRESSION_MODIFIER","schemaVersion":2,"key":"INTERMEDIATE_PROGRESSION_MODIFIER_V1","version":2,"status":"PUBLISHED","contentHash":"d8ae3a87db2a2b3976277501cc841333fd36a8b54c0639a04b39501add119de1"},"experience":"INTERMEDIATE","maximumHardSessionsPerWeek":1,"mainSetDoseMultiplier":1.0,"allowGoalPaceRehearsal":true,"allowSecondHardStimulus":false}