{"metadata":{"documentType":"PROGRESSION_MODIFIER","schemaVersion":2,"key":"ADVANCED_PROGRESSION_MODIFIER_V1","version":1,"status":"PUBLISHED","contentHash":"37a223234bbc884578f621ad40c5e2b39e962d7f6a8c60024da89fa237cd10dc"},"experience":"ADVANCED","maximumHardSessionsPerWeek":2,"mainSetDoseMultiplier":1.0,"allowGoalPaceRehearsal":true,"allowSecondHardStimulus":true}