{"metadata":{"documentType":"PROGRESSION_MODIFIER","schemaVersion":1,"key":"INTERMEDIATE_PROGRESSION_MODIFIER_V1","version":1,"status":"PUBLISHED","contentHash":"107fc930d057455a21da4ffcd94bc24feb2c02ac348edbab1e59dcc506f3a885"},"experience":"INTERMEDIATE","maximumComplexityTier":2,"maximumHardSessionsPerWeek":1,"mainSetDoseMultiplier":1.0,"allowGoalPaceRehearsal":true,"allowSecondHardStimulus":false}